,No.,Nama_Cafe_atau_Restoran,lokasi_restoran,jenis_masakan/minuman ,ulasan,sosial_media,nama_makanan,Kecamatan,Kabupaten,Cafe/restoran,Harga_Rata-rata,rating,Rentang_Harga_Rata-Rata,kecamatan,kabupaten,CR_Angka
0,1,Kantin Makanan Jepang Hana Hana,"Jl. Assumatrani No. 01, Kopelma Darussalam, Banda Aceh","Sweets, Jajanan, Jepang","gak pernah kecewa order online di hana, porsinya sesuai gkada yg kurang walaupun pesannya es serut. packagingnya rapi, dan semuanya masih hangat/dingin sesuai pesanannya. dan ada tmbahan alat2 makannya juga plus dikasih tisu juga. mantappp",@kantin_jepang_hanahana,Takoyaki,Syiah Kuala,Banda Aceh,cafe,12000,4.7,1,1,1,2
1,2,Nasi Uduk Nixas,"Jl. Teuku Nyak Arief No. 23, Syiah Kuala, Banda Aceh",Aneka nasi,rasanya enak porsinya banyak dan anak kost wajib beli ini karena porsinya banyak,@nasiuduknixas,Nasi Uduk Ayam Goreng,Syiah Kuala,Banda Aceh,restoran,16000,4.7,1,1,1,1
2,3,Island Drink House,"Jl. T. Nyak Arief, Kopelma Darussalam (Samping Bank Aceh), Kec. Syiah Kuala, Banda Aceh","Minuman, Jajanan, Thailand","Porsinya masih lebih banyak dari pada yang lain, rasa juga enak",@island.indonesia,Yogurt Mango,Syiah Kuala,Banda Aceh,cafe,16000,4.8,1,1,1,2
3,4,"King Fried Chicken, Darussalam","Jl. Teuku Nyak Arief No. 10 (Kopelma Darussalam), Syiah Kuala, Banda Aceh","Ayam & bebek, Cepat saji",nasi nya enak kali.. ayam enak.. sambal matah biasa.. lemon tea kemanisan,@kingfriedchicken.bandaaceh,PaketGeprek Komplit,Syiah Kuala,Banda Aceh,restoran,31000,4.8,4,1,1,1
4,5,Ayam Bakar Ayam Penyet Wong Solo,"Jl. Rukoh Utama Darussalam, Syiah Kuala, Banda Aceh",Ayam & bebek,"enakk bgtt, nasinya masih hangat begitu sampai dan pulennn, ikannya juga masi hangat, bumbunya enak bgt krispi juga, dalam ikannya lembut, terus saus cabe ijonya beuhh mantap sii. pertahankan kualitasnya yaa","@wongsolo.darussalam
",Paket Ayam Bakar,Syiah Kuala,Banda Aceh,restoran,29000,4.8,3,1,1,1
5,6,KFC,"Jl. Teuku Nyak Arif No. 17, Syiah Kuala, Banda Aceh",Cepat saji,"Baik banget , ramah, sopan",@kfclamnyongaceh,Jagoan Hemat,Syiah Kuala,Banda Aceh,restoran,47500,4.7,4,1,1,1
6,7,Nasi Uduk Kelapa Dua,"Jl. T. Nyak Arief, Syiah Kuala, Banda Aceh","Seafood, Aneka nasi, Ayam & bebek",Nasi Uduk tiap hari pesannya cm disini doank. Dahlah markotop,@nasiudukkelapadua,Nasi uduk Ikan Nila K2,Syiah Kuala,Banda Aceh,restoran,25000,4.7,3,1,1,1
7,8,Martabak Mesir & Bangka Annajah,"Jl. Teuku Nyak Arief (Lamnyong Swalayan), Syiah Kuala, Banda Aceh",Martabak,Kece Banget Chefnya Bisa Nyamain Rasa Di Lidah Org,@martabakmesir_mie_aceh_sabena_,Kecil Ayam,Syiah Kuala,Banda Aceh,cafe,23000,4.5,2,1,1,2
8,9,Nasi Uduk Nufana,"Jl. T. Nyak Arief (Depan SPBU Lamnyong), Syiah Kuala, Banda Aceh","Aneka nasi, Ayam & bebek, Seafood","rasanya enak tp ayamnya terlalu kecil,sambal nya jg kurang pedas tapi enakk deh","@nasiuduknufana
",Nasi Uduk Ayam Nufana,Syiah Kuala,Banda Aceh,restoran,20000,4.7,2,1,1,1
9,10,Metro Nasi Soto,"Jl. T. Nyak Arief, Syiah Kuala, Banda Aceh",Bakso & soto,Selalu puas karna apa yg dingin pelangga selalu terpenuhi makasih,@metronasisoto,Nasi Soto,Syiah Kuala,Banda Aceh,restoran,25000,4.6,3,1,1,1
10,11,Nasi Uduk Cekmi,"Jl. T. Nyak Arief, Syiah Kuala, Banda Aceh",Aneka nasi,Sambel nya aseeeemmm,@suhaimi.suhaimi.94009,Aneka Juice,Syiah Kuala,Banda Aceh,restoran,6000,4.4,1,1,1,1
11,12,Mie Turis,"Jl. T. Nyak Arif, Syiah Kuala, Banda Aceh","Bakmie, Seafood",mienya pedas bisa pedas tapi jngan terlalu pedas,@mie_turis,Indomie Udang,Syiah Kuala,Banda Aceh,cafe,20000,4.6,2,1,1,2
12,13,"King Fried Chicken, Lampineung","Jl. T Panglima Nyak Makam No. 28, Kuta Alam, Banda Aceh","Ayam & bebek, Cepat saji","sambalnya mantab, ini yg bikin juara",@kingfriedchicken.bandaaceh,PaketGeprek Komplit,Kuta Alam,Banda Aceh,restoran,31000,4.7,4,2,1,1
13,14,"Qeez Pancake, Kp. Pineung","Jl. Tgk. Chik Dipineung Raya No. 49, Syiah Kuala, Banda Aceh","Aneka nasi, Jajanan","Rasany berbeda, ayamny terlalu kering dgoreng.",@qeez_pancake,Nasi Bakar Teri + Ayam Goreng,Syiah Kuala,Banda Aceh,restoran,32000,4.8,4,1,1,1
14,15,"Daus Nasi Goreng dan Mie Khas Aceh, Lampineung","Jl. T. Panglima Nyak Makam, Kuta Alam, Banda Aceh",Aneka nasi,"Sesuai namanya, udah lejen.....",@dausnasigorenglampineung,Nasi goreng Seafood,Kuta Alam,Banda Aceh,restoran,48000,4.6,4,2,1,1
15,16,"Quantum Coffee & Brasserie, Lampineung","Jl. P. Nyak Makam, Syiah Kuala, Banda Aceh","
Barat, Chinese, Minuman","pesaanya kwetiaw daging, tp yg dibuat kwetiaw seafood  cnasgor sapi lada hitamnya tetap the best",@quantum.id,Espresso,Syiah Kuala,Banda Aceh,cafe,26000,4.7,3,1,1,2
16,17,JCO,"Jl. T Panglima Nyak Makam No. 7, Syiah Kuala, Banda Aceh","Roti, Jajanan, Minuman",cepat sampai dan pesannannya pas terimkasih...,@jco_BandaAceh,Donuts 1 Dzn,Syiah Kuala,Banda Aceh,cafe,105000,4.7,4,1,1,2
17,18,Seven Kei,"Jl .T. Nyak Makam No 17, Kuta Alam, Banda Aceh",Minuman,"rasanya emg seger apalagi yg butterfly tea, harga juga murah bagi anak SMA, untuk varian salted caramel nya enak juga , pokoknya butterfly emg fav bet si",@Seven_Kei,Choco hazelnut Latte,Kuta Alam,Banda Aceh,cafe,23000,4.8,2,2,1,2
18,19,"Pondok Orenz, Beurawe","Jl. T Hasan Dek, Kuta Alam, Banda Aceh","Aneka nasi, Seafood",Langganan. Paling suka sama nasi goreng dan sambalnya.,@pondokorenz,Paket Nasi Ayam Bakar,Kuta Alam,Banda Aceh,restoran,25000,4.7,3,2,1,1
19,20,"Ayam Geprek D'Ja, Lampriet","Jl. Gabus No. 41G, Kuta Alam, Banda Aceh",Ayam & bebek,smua²nyaaaa enk n bagus,@ayamgeprekdja12,Ayam Bakar Taliwang Khas D'ja + Nasi,Kuta Alam,Banda Aceh,restoran,16000,4.6,1,2,1,1
20,21,"Ayam Lepas, Lampriet","Jl. Kartika (Depan SMA 3), Kuta Alam, Banda Aceh",Ayam & bebek,"Ayamnya gurih mantap, apalagi sambal Lepaas nya juara",@ayam_lepas_lampriet,Paket Lele + Es Teh,Kuta Alam,Banda Aceh,restoran,25000,4.8,3,2,1,1
21,22,"Risol Spesial Banda, Asrama PHB","Asrama PHB, Jl. Nirbanya 1 No. 8, Kuta Alam, Banda Aceh","Minuman, Cepat saji, Jajanan",panasss pas di anter segerrr pkokny mantap,@risol_spesial_BNA,Risol Margo Viral Isi 5,Kuta Alam,Banda Aceh,cafe,32000,4.4,4,2,1,2
22,23,"Moorden Coffee, Beurawe","Jl. T Iskandar No. 13, Kuta Alam, Banda Aceh","Jajanan, Aneka nasi, Kopi","ngak perlu di ragukan, bakalan buat orang kangen dijamin",@moordencoffee,Nasi Goreng Kampung + Telor,Kuta Alam,Banda Aceh,restoran,27000,4.8,3,2,1,1
23,24,"King Kebab, Lamdingin","Jl. Syiah Kuala No. 191 (Sebelum Waroeng Nenek), Kuta Alam, Banda Aceh","
Timur Tengah, Jajanan","Best rasanya , memang sipaling teulom lom",@king.kebabb,Omelet Kebab,Kuta Alam,Banda Aceh,cafe,25000,4.7,3,2,1,2
24,25,"Mie Fadil, Sp. Tgk Di Blang","Jl. Syiah Kuala (Sp.Tgk Di Blang), Kuta Alam, Banda Aceh",Bakmie,"mantap mie nya, dagingnya egk pelit dipertahankan",@miefadil_sp.tgkdiblang,Mie Cumi-Cumi,Kuta Alam,Banda Aceh,cafe,25000,4.7,3,2,1,2
25,26,"Malioboro Seafood, Beurawe","Jl. T. Iskandar No. 5 (Disamping Kubra), Kuta Alam, Banda Aceh","Aneka nasi, Cepat saji","laen pas , masakkan nyaa enak masih panas .",@Malioboro_Seafood,Mie Aceh,Kuta Alam,Banda Aceh,cafe,12000,4.6,1,2,1,2
26,27,"Banda Banana, Gabus","Jl. Pocut Baren No. 110, Kuta Alam, Banda Aceh",Jajanan,"pesanan saya kuenya enak, pas matang nya, gak keras dan juga tidak lembek belum matang",@banda_banana,Coklat,Kuta Alam,Banda Aceh,cafe,22000,4.6,2,2,1,2
27,28,"Pizza Hut, Banda Aceh","Jl. Teuku HM Daud Beureueh No. 3, Kuta Alam, Banda Aceh","
Barat, Jajanan, Ayam & bebek, Pizza & pasta, Cepat saji",enak dan nikmat banget mantap,@PizzaHut_BandaAceh,Genshin Pizza.,Kuta Alam,Banda Aceh,cafe,136001,4.7,4,2,1,2
28,29,"Nasi Padang Aceh Buk Lia, Kuta Alam","Jl. Mayjen T Hamzah Bendahara, Kuta Alam, Banda Aceh","Ayam & bebek, Aneka nasi",Na,@NasiPadang_Lia,Nasi + Ayam Goreng,Kuta Alam,Banda Aceh,restoran,13000,4.6,1,2,1,1
29,30,"Pizza Banda, Syiah Kuala","Jl. Syiah Kuala, Kuta Alam, Banda Aceh",Pizza & pasta,"Sumpaaahhh, enak bangettt, topingnya gak pelit dan rotinya enak, aku beli 2 pizza kecil kadang di kash bonus jugaa terima kasih banyak kak, semoga jangan di turunin kualitasnya",@pizza_banda,Lasagna beef Size 250 Ml,Kuta Alam,Banda Aceh,cafe,32300,3.9,4,2,1,2
30,31,"Nasi Goreng Pattaya Ayah Son, Batoh","Jl. Dr. Ir. T. Moh. Hasan (Namdua Coffee), Banda Raya, Banda Aceh",Aneka nasi,agak kurang mantap. ga sperti biasanya,@NasiGoreng_Pattaya,Nasgor Biasa + Telur,Banda Raya,Banda Aceh,restoran,15000,4.6,1,3,1,1
31,32,"Burger Bangor Express, Banda Aceh","Jl. Masjid Al Huda No. 8A Kp. Laksana, Kec. Kuta Alam, Banda Aceh 23121","Barat, Jajanan, Cepat saji, Ayam & bebek",Mantap. Tanpa saus udah nikmat.,@burgerbangor.bandaaceh,Buy 1 Get 1 Burger Bangor,Kuta Alam,Banda Aceh,cafe,50000,4.7,4,2,1,2
32,33,"Koekie Katsu, Syiah Kuala","Jl. Syiah Kuala No. 38-32 Bandar Baru, Kuta Alam, Banda Aceh","Cepat saji, Jepang, Aneka nasi",terbaik emang katsu disini,@koekie.katsu,Chicken Katsu Sambal Matah,Kuta Alam,Banda Aceh,restoran,28000,4.6,3,2,1,1
33,34,"Richeese Factory, Banda Aceh","Jl. Tengku H. M. Daud Beureuh, Kuta Alam, Banda Aceh","Aneka nasi, Cepat saji, Ayam & bebek","enakk bgt, saus keju nya bkin nagihh, pedes nya juga nampolll",@richeese_factory,Combo Super Hot Deal 1,Kuta Alam,Banda Aceh,restoran,28000,4.7,3,2,1,1
34,35,"Queen Food & Drink, Kec. Syiahkuala, Rukoh","Jl. Utama Rukoh, Lorong Lamara I Perumahan Aiaman Regency, No.A4, Kec Syiahkuala, Banda Aceh","Minuman, Jajanan, Aneka nasi",nasi gorengnya enakkk,@Queen_Food&Drink,Nasi Ayam Kalasan,Syiah Kuala,Banda Aceh,restoran,18000,4.6,2,1,1,1
35,36,"Ayam Penyet Nagoya Baru, Batoh","Jl. T. M. Hasan, Banda Raya, Banda Aceh",Aneka nasi,mantappp.nasinya enak.kemasannya rapi,,Ayam Penyet + Nasi Uduk,Banda Raya,Banda Aceh,restoran,22000,4.7,2,3,1,1
36,37,"Martabak Durian Samudra Pase - Mdsp, Kuta Alam",Jl Tgk Daud Beureueh,"Bakso & soto, Martabak, Aneka nasi",enak kayak yg di geudong,@martabak_durian_geudong_pasee,Martabak Durian,Kuta Alam,Banda Aceh,restoran,13000,4.2,1,2,1,1
37,38,"Abbi Kebab Dan Burger, Ulee Kareng","Jl. Panglima Nyak Makam, Lampineung, Kuta Baru Kec. Kuta Alam, Banda Aceh",Barat,mantapppp banget rasanya.,@Abbi_Kebab&Burger,Burger Big Telur Daging Sosis,Kuta Alam,Banda Aceh,cafe,12500,4.7,1,2,1,2
38,39,"Ayam Geprek Dan Nasi Bakar Mahasiswa, Jalan Lingkar Kampus UIN",Jalan Lingkar Kampus UIN Ar-Raniry,"Aneka nasi, Ayam & bebek, Minuman",Enak banget selalu langganan disini,@NasiBakar_mhs,PROMOOO... Nasi Ayam Bakar,Syiah Kuala,Banda Aceh,restoran,21500,4.1,2,1,1,1
39,40,"Pajooh Kebab, Syiah Kuala","Jl. Teuku Nyak Arief, Syiah Kuala, Banda Aceh","Cepat saji, Timur Tengah","manteeep , puas dengan porsinya",@pajooh_kebab,Kebab sedang,Syiah Kuala,Banda Aceh,cafe,18000,4.7,2,1,1,2
40,41,"Nasi Bebek Ayam Istimewa, Peunayong","Jl. Pocut Baren, Peunayong, Kuta Alam, Banda Aceh",Ayam & bebek,"selalu enakkkk, dan sesuai request..",Na,Nasi Kari Bbek,Kuta Alam,Banda Aceh,restoran,20000,4.7,2,2,1,1
41,42,"Nasi Uduk Ayam Penyet Cili, Pocut Baren","Jl. Pocut Baren (Ie Teh Kupi), Kuta Alam, Banda Aceh",Aneka nasi,enakkk bangettt,Na,Nasi Putih Ayam Penyet,Kuta Alam,Banda Aceh,restoran,22000,3.8,2,2,1,1
42,43,"Nasi Goreng Kampung BANG DIN & Mie Aceh Rex Peunayong, Sri Ratu","Jl. Sri Ratu Syafiatuddin No. 90 (dekat Hotel Medan) Kuta Alam, Banda Aceh","Minuman, Seafood, Aneka nasi","Makan jadi gembira. Rasa Kepiting Masuk ke dlm mie. Bumbu mie Aceh masuk ke dalam kepiting. Nasi goreng kampung dan seafood, wow.... makan jadi gembira",Na,Nasi Putih Keumamah + Telur Dadar/Mata Sapi,Kuta Alam,Banda Aceh,restoran,18000,4.4,2,2,1,1
43,44,"Martabak Pecenongan 78, Peunayong Banda Aceh","Jl. T Panglima Polem No. 159, Kuta Alam, Banda Aceh","Martabak, Sweets, Roti, Jajanan",enak kaya biasanya pesan .. tapi kali ini kuah martabak nya ga dikasih.. kelupaan kali ya..,Na,Martabak Black Forest Cokelat,Kuta Alam,Banda Aceh,cafe,90000,4.6,4,2,1,2
44,45,"Alikebab, Hajidimurtala","Jl. Hajidimurtala, Simpang 5, Kuta Alam, Banda Aceh","Cepat saji, Timur Tengah",Tetap jadi kebab terenak yang pernah aku makan!,@ali_kebab_aceh,Kebab Mini,Kuta Alam,Banda Aceh,cafe,18000,4.7,2,2,1,2
45,46,"Toke Salad N Cake, Kuta Alam","Jl. T Hasan Dek No. 175, Kuta Alam, Banda Aceh","Sweets, Jajanan, Minuman","Enakkkkk bgtttttttt, first time nyoba lgsg jatuh hati ",@toke_salad_n_cake,Salad Sayur,Kuta Alam,Banda Aceh,cafe,20000,4.3,2,2,1,2
46,47,"Sate Matang Cek Li, Syiah Kuala","Jl. Teungku Lamgugob, Syiah Kuala, Banda Aceh","Sate, Cepat saji, Aneka nasi","satenya kurang setusuk bg pesan 15, jadi 14 tusuk hihi",@sate_matang_cekli,Sate Matang 10 Tusuk,Syiah Kuala,Banda Aceh,restoran,33000,4.5,4,1,1,1
47,48,"Galang Burger, Kuta Alam Kampung Laksana",Jln Dharma Kampung Laksana Banda Aceh.,"Jajanan, Roti, Martabak",Na,Na,Burger Daging,Kuta Alam,Banda Aceh,cafe,14000,4.7,1,2,1,2
48,49,"Riski Kebab, Darussalam (Samping BreadBoy)",Darussalam,"Cepat saji, Roti, Timur Tengah",Na,Na,Burger Special,Syiah Kuala,Banda Aceh,cafe,23000,4.8,2,1,1,2
49,50,"ABI BURGER KEBAB, ROTI BAKAR, Teuku Nyak Arief","Jl. Teuku Nyak Arief, Syiah Kuala, Banda Aceh","Roti, Cepat saji, Jajanan","burgernya enak, tp sausnya trlalu byk jd klo makan agak belepotan. tapi tetap enak kok tpi packagingnya boleh ditingkatin lgi",Na,Roti Bakar Bandung Rasa Coklat Keju,Syiah Kuala,Banda Aceh,cafe,18750,4.6,2,1,1,2
50,51,"Linge Coffee Home Roasting, Kp. Laksana","Jl. Mesjid Alhuda No. 54, Kuta Alam, Banda Aceh","Cepat saji, Minuman, Kopi",paten.....kopinya the best,Na,Wine Coffee Cold Brew,Kuta Alam,Banda Aceh,cafe,35000,4.5,4,2,1,2
51,52,"Mie Pangsit Ayam Keriting Khas Medan, Kampung Laksana","Jl. Al-Huda No. 32B, Kuta Alam, Banda Aceh","Bakso & soto, Bakmie, Minuman",GoodJob rasa nya sesuai ekspektasi...mantaaap pull...,Na,Mie Kasar Ayam + Pangsit 2,Kuta Alam,Banda Aceh,cafe,19000,4.7,2,2,1,2
52,53,"Kuta Alam Roastery, Kuta Alam","Jl. Jambi, Kuta Alam, Banda Aceh","Minuman, Kopi",sanger press best banget,@kutaalamroaestery,ced Chocolate LAVA Latte,Kuta Alam,Banda Aceh,cafe,20000,4.8,2,2,1,2
53,54,"Soto Riza, Peunayong","Jl. Khairil Anwar No. 11a, Peunayang, Kuta Alam, Banda Aceh","Aneka nasi, Bakso & soto, Minuman","terima kasih banyak, makanannya enak",@soto.riza,Soto Daging,Kuta Alam,Banda Aceh,restoran,32000,4.6,4,2,1,1
54,55,"Mie Pangsit Ayam ETE, Teluk Betung","Jl. Teluk Betung 5, Kuta Alam, Kota Banda Aceh","Bakmie, Aneka nasi","enakkk bgttt, parrrah! pangsit rebusnya bener2 full daging beda sama pangsit2 lain, mienya kenyel, kuahnya si b aja tapi gk nyangka ada yg enak jg di Banda Aceh ",Na,Mie Pangsit Goreng,Kuta Alam,Banda Aceh,cafe,23750,4.8,3,2,1,2
55,56,"Ayam Geprek Istimewa, Pocut Baren","Jl. Pocut Baren No. 57B, Keuramat, Kuta Alam, Banda Aceh",Aneka nasi ,makanannya enak cmn kecil ayamnya...,Na,Ayam Geprek Istimewa Level 5 + Nasi,Kuta Alam,Banda Aceh,restoran,15000,4.2,1,2,1,1
56,0,"Bubur Ayam Jakarta Bintaro, T. Panglima Polem","Jl. T Panglima Polem (Depan Vihara), Kuta Alam, Banda Aceh","
Aneka nasi, Bakmie, Chinese","Buburnya Pas..porsi,rasa,kebersihan dan kemasan ok semua",Na,Bubur Ayam Jakarta,Kuta Alam,Banda Aceh,cafe,23000,4.6,2,2,1,2
57,58,"Rumoh Dimsum, Kaswari","Jl. Kaswari No.3, Kuta Alam, Banda Aceh","Chinese, Jajanan",selalu de best disini gak pernah ngecewain,@rumohdimsum,Dimsum Ayam (1/2 Box) frozen,Kuta Alam,Banda Aceh,cafe,47000,4.7,4,2,1,2
58,59,"Mie Pangsit Duta Bireuen, Lamnyong","Jl. T. Nyak Arief (Lamnyong), Lamgugob, Syiah Kuala, Banda Aceh (Di Samping JNT/ Diseberang Awak Awai 2)","
Bakmie, Minuman, Chinese",terimakasih. kurang banyak dehhh,@mie.pangsitdutabireuen,Mie Pangsit Kuah,Kuta Alam,Banda Aceh,cafe,17500,4.6,1,2,1,2
59,60,Olenka Cafe & dining,"Jl. teuku lamgugop No.31, Lamgugop, kec. Syiah Kuala, Kota Banda Aceh","Aneka nasi, Kopi, Barat","enaaaaak bgt.. minyaknya jg dipisah, love deh. kalo ga suka ya ga dipake.. tp aku makan semuanyaa ahaha makasi atas makannyaa",@olenkaCafe,Ice Coffee Zalinka,Syiah Kuala,Banda Aceh,cafe,27500,4.7,3,1,1,2
60,61,"Roti'O, Poma Aceh","Jl. Tengku Daud Beureuh No. 173, Bandar Baru, Kuta Alam, Banda Aceh",roti,Sangat sesuai dengan keinginan,Na,Kopdar 1 (Kopi'O Brown Sugar & Roti'O),Kuta Alam,Banda Aceh,cafe,30000,4.8,4,2,1,2
61,62,Station Coffee Premium Banda Aceh,"Desa Mibo, Kec. Banda Raya, Kota Banda Aceh, Aceh.","Seafood, Aneka nasi, Kopi",porsinya msh kekecilan untuk ukuran harga 25 rbu.maapkan cm saran yaa...,@stationcoffepremium,Avocado Coffee,Banda Raya,Banda Aceh,cafe,25000,4.8,3,3,1,2
62,63,"Nasi Gurih & Lontong Pagi Bu Ema, Kuta Alam","Jl. T Hamzah Bendahara (Disamping Hotel Diana), Kuta Alam, Banda Aceh",aneka nasi ,"Pedasnya ok. Dan aku suka, krn sesuai banget dg di cttn nya. Aku pesan di note, sambalnya pisah dari nasinya. Dan pesanan dtg sesuai permintaan, sambalnya bener2 dipisah, krn yg itu buat si kcl.",Na,Nasi Gurih Telur Dadar,Kuta Alam,Banda Aceh,restoran,15000,4.7,1,2,1,1
63,64,"D'COST, Lippo Plaza Aceh","Jl. T. Hasan Dek, Beurawe, Kec. Kuta Alam, Kota Banda Aceh, Aceh 23127","Seafood, Aneka nasi, Ayam & bebek",ini enak bgt. jatuh cinta sama buncis singaporenya. suka bgt.,@dcost.seafood,Nasi Capcay Seafood,Kuta Alam,Banda Aceh,restoran,32500,4.7,4,2,1,1
64,65,"Chatime x Cupbop, Lippo Plaza Aceh","Lippo Plaza, GF - 03, Jl. T Hasan Dek, Kuta Alam, Banda Aceh","Korea, Minuman, Kopi, Jajanan",tteokbokinya manteppp puolll,@chatimebandaaceh,Choco Mousse (Large),Kuta Alam,Banda Aceh,cafe,20000,4.8,2,2,1,2
65,66,"Mr. HOT, T. Iskandar","Jl. T. Iskandar No. 4 (Belakang Matahari), Kuta Alam, Banda Aceh","Aneka nasi, Ayam & bebek, Cepat saji",Langganan geprek terasi paling joss,@mr.hot_aceh,Indomie Ayam Geprek,Kuta Alam,Banda Aceh,restoran,28000,4.6,3,2,1,1
66,67,"Alex's Kitchen, Lamlagang","Jl. Sultan Malikul Saleh, Banda Raya, Banda Aceh","Aneka nasi, Jepang, Barat",Trmksh chef sehat dan sukses Selalu,@kitchenalexs,Mie Ayam Jamur,Banda Raya,Banda Aceh,restoran,32000,4.7,4,3,1,1
67,68,"Jiwa Toast, Plaza Aceh Mall","Plaza Aceh Mall, Jl. T. Hasan Dek, Beurawe, Kuta Alam, Banda Aceh","Minuman, Roti, Jajanan, Cepat saji, Kopi","Good, enak bangetlah pokok nya best",@jiwatoast.bnaplazaacehmall,Spicy Bulgogi,Kuta Alam,Banda Aceh,cafe,37000,4.4,4,2,1,2
68,69,"Jala Kebab, Sultan Malikul Saleh","Jl. Sultan Malikul Shaleh (Depan Stadion Harapan Bangsa), Banda Raya, Banda Aceh","Timur Tengah, Jajanan",udah pesan berkali - kali dan selalu lagi,@kebab_jala,Kebab Ayam Jumbo,Banda Raya,Banda Aceh,cafe,25000,4.7,3,3,1,2
69,70,"Urban Teahouse, Lamlagang","Jl. Sultan Malikus saleh no. 93, Lam Lagang, Kec. Banda Raya, Kota Banda Aceh, Aceh 23231",minuman ,top markotop brooooo,@urbanteahouse.id,Japanese Matcha,Banda Raya,Banda Aceh,cafe,17000,4.6,1,3,1,2
70,71,"Bubur Ayam Pasundan, Blang Padang","Jl. K Ibrahim, Meruxa, Banda Aceh",jajanan,"Bubur, siomay & batagor terbaik di BTJ. Yuk tingkatkan kualitas kemasan dengan tidak memakai styrofoam lagi atau berikan opsi seperti pakai box+biayanya. Saran saya bumbu kacang dipisah saja dari cabai agar bisa disesuaikan tingkat kepedasannya",@buburayampasundanspensix,Bubur Ayam Spesial Pasundan,Meuraxa,Banda Aceh,cafe,15000,4.7,1,4,1,2
71,72,"Sosis Telur (SOSTEL), Ulee Lheue","Jl. Pelabuhan Lama Ulee Lheue, Meuraxa, Banda Aceh",jajanan,Na,Na,Sosis Telur Balado,Meuraxa,Banda Aceh,cafe,8000,4.1,1,4,1,2
72,73,"Ayam Bakar KQ-5, Banda Aceh","Jl. Diponegoro Simpang 5, Kuta Alam, Banda Aceh",Ayam & bebek,yam lamongan wueenakk apa lagi klo makan di restonya lebih yamiii,Na,Naskot Ayam Lamongan,Kuta Alam,Banda Aceh,restoran,28000,4.8,3,2,1,1
73,74,"Quality Fried Chicken, Pocut Baren","Jl. Pocut Bare (Depan Dinas Kebersihan Kota Banda Aceh), Kuta Alam, Banda Aceh",Ayam & bebek,enak bngtttt. sausnya pedessss ayamnya gede. makaasii yaaa. syg bgt sm yg masak hehehe,@qualityfriedchickenid,Creative 1,Kuta Alam,Banda Aceh,restoran,33000,4.8,4,2,1,1
74,75,"Ketoprak Jakarta, Kp. Keuramat","Jl. Nuri No. 13, Kuta Alam, Banda Aceh",jajanan,"medok, enak dan murah",Na,"Telur,Tahu,Bumbu Kacang",Kuta Alam,Banda Aceh,cafe,15000,4.6,1,2,1,2
75,76,"Permata Hati Pastry Bakery and Cake, Meuraxa","Jl. Sultan Iskandar Muda No. 217, Meuraxa, Banda Aceh","Roti, Minuman, Kopi",Na,Na,Expresso Double,Meuraxa,Banda Aceh,cafe,10000,,1,4,1,2
76,77,Robinson Bakery,Jln. A.Yani No.31 Peunayong Banda Aceh,roti ,porsi udah ga sempurna,@robinson_bakery,Roti Tawar Besar,Kuta Alam,Banda Aceh,cafe,20000,4.6,2,2,1,2
77,78,CAFFEE LIMA,Jl. Politeknik Aceh Beurawe,"Minuman, Cepat saji, Roti",Na,Na,Lechy Yakult,Kuta Alam,Banda Aceh,cafe,20000,4.6,2,2,1,2
78,79,"Aroma Bakery and Cake Shop, Beurawe, Jl. T. Hasan Dek","Jl. T. Hasan Dek, Beurawe, Kec. Kuta Alam, Kota Banda Aceh, Aceh",roti,Na,@aromabakeryandcakeshop,Roti Sobek Coklat,Kuta Alam,Banda Aceh,cafe,20800,4.8,2,2,1,2
79,80,"HM Dimsum & Kebab, Lhong Raya - Banda Raya",Choco hazelnut Latte,"Jajanan, Cepat saji, Roti",Na,Na,Dimsum Ayam / isi 4,Banda Raya,Banda Aceh,cafe,20000,4.7,2,3,1,2
80,81,"Maroon Cake and Pastry, Lampriet","Jl. T.M. Daud Beureueh No. 153 (Wisma Lampriet), Kuta Alam, Banda Aceh","
Sweets, Roti, Barat",memang selalu sesuai harapan.. terima kasih maroon...,@marooncakeandpastry,Pain au Chocolate,Kuta Alam,Banda Aceh,cafe,25000,4.7,3,2,1,2
81,82,Haba Coffee,"Jl. Tgk Moh. Daud Beureuh, Lampriet, Kec. Kuta Alam, Kota Banda Aceh","Minuman, Roti, Kopi",da best... always ,@habacoffee,Haba Dark Latte,Kuta Alam,Banda Aceh,cafe,29000,4.6,3,2,1,2
82,83,"JCO, Nyak Makam Aceh","Jl. T Panglima Nyak Makam No. 7, Syiah Kuala, Banda Aceh","Jajanan, Minuman, Roti",cepat sampai dan pesannannya pas terimkasih....,@jcoindonesia,Donuts 1/2 Dzn,Syiah Kuala,Banda Aceh,cafe,62000,4.7,4,1,1,2
83,84,"Ligat Coffee, Gp Keuramat","Jl. Teladan, Keuramat, Kuta Alam, Kota Banda Aceh","Minuman, Roti, Kopi",Na,Na,Ais Kopsu Ligat,Kuta Alam,Banda Aceh,cafe,20000,,2,2,1,2
84,85,Kanarasa Coffee,Jl P Nyak Makam No 3 Gampung Kota Baru Kecamatan Kuta Alam Banda Aceh,"Minuman, Kopi, Roti",se seger itu kuah indomienya!!,@kanarasacoffee,Kopi Kana,Kuta Alam,Banda Aceh,cafe,25000,4.8,3,2,1,2
85,86,"Banna Foody, Jeulingke","Jl. T. Nyak Arief, Syiah Kuala, Banda Aceh (Disamping Hotel Syariah Lingke)","Minuman, Jajanan, Roti",Na,@bannafoody,Basreng Premium Pedas Daun Jeruk,Syiah Kuala,Banda Aceh,cafe,11000,4.7,1,1,1,2
86,87,"Pempek Bingen, Kuta Alam, Jl Dharma No 16 Kuta Alam",Jl Dharma No 16 Kuta Alam,"Chinese, Seafood, Jajanan","Mie celornya enak, tapi udangnya gak seperti difoto ya,udangnya cuma berasa dikaldunya, gak ada wujudnya ",@pempek_bingen,Pempek Kapal Selam,Kuta Alam,Banda Aceh,cafe,37000,4.6,4,2,1,2
87,88,"D'CHEV CHICKEN, Jl.Iskandar Muda,Blang Oi","Jl. Iskandar Muda No.2, Blang Oi, Banda Aceh",cepat saji,Na,@d.chevchicken,Ayam Saus Korean + Keju,Meuraxa,Banda Aceh,cafe,20000,4.6,2,4,1,2
88,89,"ACEH BUMBU STORE (Oleh Oleh Bumbu Instan ), Peunayong, Banda Aceh","Jl. A. Yani No. 64, Kuta Alam, Banda Aceh","Aneka nasi, Cepat saji, Jajanan",Na,@aceh_bumbu_store,Sambal Baby Cumi Bawang,Kuta Alam,Banda Aceh,restoran,29500,3.6,4,2,1,1
89,90,"BUBUR KANJI BAMBY AWAK AWAI, PEUNAYONG Kuta Alam BANDAACEH",JL.H.T.Daudsyah No 1 Peunayong Banda Aceh,"Cepat saji, Aneka nasi, Jajanan","mantap, rasa buburnya bikin kita anget. pas bgt aku lg sakit makan ini, bikin anget dan nyaman",@buburkanjibamby_banda_ac,Bubur Kanji Ayam Pakai Cup 650 ml,Kuta Alam,Banda Aceh,restoran,17000,4.6,1,2,1,1
90,91,"Dapur Deqa, Warkop Dewantara","Jl. T. Panglima Polem No 149, Peunayong, Kuta Alam, Kota Banda Aceh","Aneka nasi, Cepat saji, Bakso & soto",Na,@dapur.deqa,Soto Daging,Kuta Alam,Banda Aceh,restoran,27000,4.4,3,2,1,1
91,92,"Warung Sumar, Kuta Alam/Asrama Kuta Alam",Jl.T Hamzah Bendahara Tni Ad Kuta Alam Depan Penerbit Erlangga Kuta Alam Banda Aceh,"Minuman, Cepat saji, Bakso & soto",Na,Na,Mie Bakso Besar,Kuta Alam,Banda Aceh,cafe,15000,4.3,1,2,1,2
92,93,"Sei Sapiku Sei Sapi, Aceh","Jln Sultan Iskandar Muda, Cot Lamkuweueh, Meuraxa, Banda Aceh City, Aceh,","Barat, Aneka nasi, Jajanan",enak burgernya berasa bumbunya,@seisapikuaceh,Burger Se'i Ayam,Meuraxa,Banda Aceh,restoran,34000,4.7,4,4,1,1
93,94,"Kopi Kenangan, SPBU Lamnyong Aceh","Jl. Teuku Nyak Arief, Lamnyong, Syiah Kuala, Banda Aceh","Minuman, Kopi, Jajanan, Sweets",Kayaknya bakal sering beli hot chocolate disinii xixixi,@kopikenangan.id,Kopi Susu Black Aren,Syiah Kuala,Banda Aceh,cafe,23000,4.7,2,1,1,2
94,95,"Soto Sikembar, Kec Kuta Alam (Haw Haw Kopi )","Jl. Mayjen T Hamzah Bendahara, Kuta Alam, Kec Kuta Alam Banda Aceh","Aneka nasi, Ayam & bebek, Bakso & soto","daging dan paru nya tidak ada, hanya kuah saja",Na,Nasi Putih + Sop Ayam,Kuta Alam,Banda Aceh,restoran,23000,4.0,2,2,1,1
95,96,"Bakso Isaura Premium, Peunayong","Jl. WR Suoratman No 77, Peunayong, Kec Kuta Alam, Kota Banda Aceh","Bakso & soto, Bakmie","Kuah kaldunya enak, saat udah dingin masih bisa dimakan karena gak berlemak. Mie ayamnya enak tapi ada sepotong kecil plastik biru di dalam salah 1 bungkus mie ayamnya. Tolong diperhatikan lg kebersihannya, plastik yg terkena panas kan berbahaya.",@baksoisaurapremium,Bakso Mangkok Mie Ayam,Kuta Alam,Banda Aceh,cafe,40000,3.8,4,2,1,2
96,97,"Baso Aci Akang, Banda Aceh","Jl. Teuku Moh Daud Beureueh No.147, Beurawe, Kuta Alam, Banda Aceh","Jajanan, Bakso & soto",enak semuanya. recommended bgt bagi yg suka baso aci serta lainnya next bakal makan di sini lagii. tapi untuk minuman bagi saya terlalu manis. sukses selaluuuu,@basoaciakang,Mie Jebew Boci,Kuta Alam,Banda Aceh,cafe,20000,4.6,2,2,1,2
97,98,"Muda Bakso Lampriet & Mie Ayam Pangsit, Kuta Alam","Jl. Cumi Cumi No. 19, Kuta Alam, Banda Aceh","Bakmie, Bakso & soto, Aneka nasi",bakso gede nya kurang cabe ,@muda_bakso,Indomie Bakso,Kuta Alam,Banda Aceh,restoran,14990,4.4,1,2,1,1
98,99,"Foodpedia, Banda Aceh","Jl. T Nyak Arief Lamgugop, Syiah Kuala, Banda Aceh","Minuman, Cepat saji, Bakso & soto",Baksonya gede dan enak.Puas,@foodpedia.official,Curacou Lime Blue,Syiah Kuala,Banda Aceh,cafe,15000,4.6,1,1,1,2
99,100,"Aluk Kupi, Kuta Alam/Peunayong/Aluk Kupi",Jln Twk Mohammad Daudsyah No 56,roti,Na,Na,Kue Kacang,Kuta Alam,Banda Aceh,cafe,7000,4.8,1,2,1,2
